{
  "$schema": "https://json-schema.org/draft/2020-12/schema",
  "$id": "https://meaningfulparticipation.org/schema/0.1/ecosystem-relationship.json",
  "title": "MPP Ecosystem Relationship",
  "description": "An Ecosystem Relationship conforming to Meaningful Participation Protocol v0.1.",
  "type": "object",
  "additionalProperties": false,
  "required": [
    "type",
    "mppVersion",
    "id",
    "sourceEcosystem",
    "relationshipType",
    "targetEcosystem",
    "assertedByParticipant",
    "effectiveFrom",
    "recordCreationTimestamp"
  ],
  "properties": {
    "type": {
      "const": "EcosystemRelationship"
    },
    "mppVersion": {
      "type": "string",
      "const": "0.1"
    },
    "id": {
      "type": "string",
      "minLength": 1,
      "description": "A persistent, globally unique Ecosystem Relationship identifier."
    },
    "sourceEcosystem": {
      "$ref": "#/$defs/ecosystemReference"
    },
    "relationshipType": {
      "type": "string",
      "minLength": 1,
      "description": "The core or Ecosystem-defined Relationship Type."
    },
    "targetEcosystem": {
      "$ref": "#/$defs/ecosystemReference"
    },
    "assertedByParticipant": {
      "$ref": "#/$defs/assertingParticipant"
    },
    "relationshipDescription": {
      "type": "string",
      "minLength": 1,
      "description": "An optional human-readable description of the relationship."
    },
    "relationshipScope": {
      "$ref": "#/$defs/relationshipScope"
    },
    "effectiveFrom": {
      "type": "string",
      "format": "date-time",
      "description": "The time from which the Ecosystem Relationship is effective."
    },
    "expiresAt": {
      "type": "string",
      "format": "date-time",
      "description": "The time at which the Ecosystem Relationship expires, where applicable."
    },
    "recordCreationTimestamp": {
      "type": "string",
      "format": "date-time",
      "description": "The time at which the Ecosystem Relationship was created."
    },
    "evidence": {
      "type": "array",
      "description": "References to Evidence objects supporting the relationship assertion.",
      "minItems": 1,
      "uniqueItems": true,
      "items": {
        "$ref": "#/$defs/evidenceReference"
      }
    },
    "privacy": {
      "$ref": "#/$defs/privacy"
    },
    "integrity": {
      "type": "object",
      "description": "Implementation-specific integrity proof or signature information.",
      "minProperties": 1,
      "additionalProperties": true
    },
    "extensions": {
      "type": "object",
      "description": "Namespaced extension properties.",
      "propertyNames": {
        "format": "uri"
      },
      "additionalProperties": true
    }
  },
  "$defs": {
    "ecosystemReference": {
      "description": "A reference to an Ecosystem.",
      "oneOf": [
        {
          "$ref": "#/$defs/identifier"
        },
        {
          "type": "object",
          "additionalProperties": false,
          "required": [
            "id"
          ],
          "properties": {
            "id": {
              "$ref": "#/$defs/identifier"
            },
            "name": {
              "type": "string",
              "minLength": 1,
              "description": "An informative human-readable Ecosystem name."
            }
          }
        }
      ]
    },
    "assertingParticipant": {
      "type": "object",
      "additionalProperties": false,
      "required": [
        "id",
        "roles"
      ],
      "properties": {
        "id": {
          "$ref": "#/$defs/identifier"
        },
        "name": {
          "type": "string",
          "minLength": 1,
          "description": "An optional informative name for the Participant."
        },
        "roles": {
          "type": "array",
          "minItems": 1,
          "uniqueItems": true,
          "contains": {
            "const": "asserter"
          },
          "items": {
            "type": "string",
            "minLength": 1
          },
          "description": "The Participant Roles assigned to the asserting Participant. The roles MUST include asserter."
        }
      }
    },
    "relationshipScope": {
      "type": "object",
      "description": "Optional limitations, conditions or domains applying to the Ecosystem Relationship.",
      "additionalProperties": false,
      "properties": {
        "participationTypes": {
          "type": "array",
          "minItems": 1,
          "uniqueItems": true,
          "items": {
            "$ref": "#/$defs/identifier"
          }
        },
        "meaningProfiles": {
          "type": "array",
          "minItems": 1,
          "uniqueItems": true,
          "items": {
            "$ref": "#/$defs/identifier"
          }
        },
        "requiredVerificationMethods": {
          "type": "array",
          "minItems": 1,
          "uniqueItems": true,
          "items": {
            "type": "string",
            "minLength": 1
          }
        },
        "requiredVerificationOutcomes": {
          "type": "array",
          "minItems": 1,
          "uniqueItems": true,
          "items": {
            "type": "string",
            "enum": [
              "verified",
              "partiallyVerified",
              "unverified",
              "disputed",
              "rejected"
            ]
          }
        },
        "effectiveFrom": {
          "type": "string",
          "format": "date-time"
        },
        "effectiveUntil": {
          "type": "string",
          "format": "date-time"
        },
        "domains": {
          "type": "array",
          "description": "Activities, programmes, services or organisational domains to which the relationship applies.",
          "minItems": 1,
          "uniqueItems": true,
          "items": {
            "type": "string",
            "minLength": 1
          }
        },
        "extensions": {
          "type": "object",
          "propertyNames": {
            "format": "uri"
          },
          "additionalProperties": true
        }
      }
    },
    "evidenceReference": {
      "description": "A reference to an independently identifiable Evidence object.",
      "oneOf": [
        {
          "$ref": "#/$defs/identifier"
        },
        {
          "type": "object",
          "additionalProperties": false,
          "required": [
            "id"
          ],
          "properties": {
            "id": {
              "$ref": "#/$defs/identifier"
            },
            "digest": {
              "$ref": "#/$defs/digest"
            }
          }
        }
      ]
    },
    "identifier": {
      "type": "string",
      "minLength": 1,
      "description": "A persistent identifier. The applicable identifier system is implementation-specific."
    },
    "digest": {
      "type": "object",
      "additionalProperties": false,
      "required": [
        "algorithm",
        "value"
      ],
      "properties": {
        "algorithm": {
          "type": "string",
          "minLength": 1
        },
        "value": {
          "type": "string",
          "minLength": 1
        }
      }
    },
    "privacy": {
      "type": "object",
      "additionalProperties": false,
      "properties": {
        "recordVisibility": {
          "type": "string",
          "enum": [
            "public",
            "restricted",
            "private"
          ]
        },
        "participantDisclosure": {
          "type": "string",
          "enum": [
            "identified",
            "pseudonymous",
            "selective"
          ]
        }
      }
    }
  }
}
